,question,answer,result,score
1,What is the role of VCs in picking companies?,The role of VCs is to be a price taker of whatever prices the market sets and to pick the companies they want to be in.,"The role of VCs (venture capitalists) in picking companies is to identify and invest in promising startups and early-stage businesses with high growth potential. They assess the market opportunity, the strength of the founding team, the product or service, and the overall potential for success. Once they pick a company, they often provide not only financial support but also strategic guidance, mentorship, and access to networks and resources to help the company grow and succeed.",INCORRECT
3,What are the potential outcomes for Bitcoin according to the text?,"There are three potential outcomes for Bitcoin: being banned, becoming too big to fail, or being used to evade taxes.","The potential outcomes for Bitcoin according to the text include:

1. Bitcoin persisting and having good staying power as an observer, with smaller cryptocurrencies getting blown out.
2. In the very long term, Bitcoin could become a non-fiat currency backed by math and cryptography instead of government fiat, but this could take decades to happen.",INCORRECT
5,What is stem cell therapy and how is it related to aging?,Stem cell therapy is a new field of work that may help stop and potentially reverse the biological process of aging.,"Stem cell therapy is a type of medical treatment that involves using stem cells to repair or regenerate damaged or diseased tissues in the body. Stem cells are unique because they have the ability to differentiate into various types of cells, making them a valuable tool for treating a wide range of conditions, including age-related diseases and degenerative conditions. In the context of aging, stem cell therapy has the potential to help with issues like hearing loss, eyesight loss, and other age-related problems by regenerating or repairing damaged cells and tissues. Additionally, induced pluripotent stem cell (IPSC) therapy, which involves converting adult cells back into stem cells, is being explored as a way to reverse aging in certain cell types and improve overall health.","INCORRECT. While the student's answer provides accurate information about stem cell therapy and its potential uses in treating age-related conditions, the true answer is not accurately reflected. The true answer states that stem cell therapy may help stop and potentially reverse the biological process of aging, while the student's answer only mentions its potential to help with age-related issues."
9,What is the difference between investing and trading?,"Investing is more about accumulation and building up positions over time, while trading is selling strategically and not driven by outside needs for capital.","The difference between investing and trading lies in the approach and time horizon. Investing is more about accumulating assets for long-term growth, typically by buying and holding stocks or other assets, and building up positions over time. Trading, on the other hand, involves more frequent buying and selling of assets, often driven by short-term market fluctuations and aiming to make profits in a shorter time frame. Investing focuses on long-term wealth creation, while trading seeks to capitalize on short-term market movements.",INCORRECT
13,What is the difference between censorship on the supply side and censorship on the demand side of the platform?,"Censorship on the supply side of the platform refers to the removal of content by the platform, while censorship on the demand side refers to the rewriting of newsfeed rules to determine what content users see.","Censorship on the supply side refers to controlling or limiting the content that is being created and shared on a platform, while censorship on the demand side refers to controlling or limiting what users can see and access on the platform. Supply side censorship focuses on the source of the content, while demand side censorship focuses on the users and their access to the content.",INCORRECT
14,What is the thesis behind institutional custody in crypto?,"The thesis behind institutional custody in crypto is that crypto would go more institutional and endowments and so on are realizing they need to have some portion, maybe one or two percent of their portfolio in crypto.","The thesis behind institutional custody in crypto is that as the cryptocurrency market grows and matures, there will be an increasing demand for secure, regulated, and professional custody solutions for institutional investors and large-scale market participants. These investors require a higher level of security, compliance, and risk management than retail investors, and traditional custodial services may not be equipped to handle the unique challenges and requirements of managing digital assets. Institutional custody in crypto aims to provide these services, ensuring the safekeeping of digital assets while also enabling institutions to access the broader ecosystem of cryptocurrency investments and opportunities.","INCORRECT. The student's answer provides a more detailed and accurate explanation of the thesis behind institutional custody in crypto, while the true answer only mentions the idea that institutions are realizing they need to invest in crypto."
16,What was one of the reasons why Donald Trump was elected in 2016?,"Donald Trump was elected, in no small part, because he pledged to put justices on the court who would overrule Roe and Casey.","One of the reasons why Donald Trump was elected in 2016 was because of the issues he ran on, such as the trade issue with China, which resonated with voters in Rust Belt states.",INCORRECT
17,What is the principle of stare decisis and how is it relevant to the discussion of Roe?,The principle of stare decisis is the legal principle of determining points in litigation according to precedent. It is relevant to the discussion of Roe because Justice Alito's draft opinion outlines this principle and argues that Roe should be overruled despite being a precedent.,"The principle of stare decisis is a legal doctrine that states courts should generally follow and uphold their previous decisions, especially when those decisions have been in effect for a long time and have established a precedent. It is relevant to the discussion of Roe (Roe v. Wade) because Roe and its subsequent reaffirmation in Casey (Planned Parenthood v. Casey) have established a precedent on abortion rights for over 50 years. The principle of stare decisis suggests that the Supreme Court should not overturn these decisions without a good reason, as doing so would disrupt the established legal framework and potentially undermine the court's credibility.","INCORRECT. The student's answer is mostly correct in defining stare decisis and its relevance to Roe, but the true answer clarifies that Justice Alito's draft opinion argues for overturning Roe despite it being a precedent."
22,What is the author's opinion on the role of antitrust in promoting innovation?,"The author believes that without the threat of antitrust action, big monopolies or duopolies will stifle innovation and become gatekeepers.","The author believes that antitrust should be focused on ensuring competition and promoting innovation. They express concerns about the potential chilling effect on reasonable exits in Silicon Valley if antitrust is approached in a punitive way, which could hinder innovation. Instead, they suggest using other tools to rein in monopolies, such as allowing side loading and enabling competitive app stores, which could help promote innovation and competition in the market.",INCORRECT
26,What happened to Yammer after it was folded into the office suite?,"Yammer disappeared because it didn't have its own independent pricing and sales team, and the promotion of it stopped because nobody had an incentive to sell or market it.",Yammer was acquired by Microsoft and got integrated into the Office suite. It has been somewhat buried inside of Microsoft but is still available and used by some organizations for internal communication and collaboration.,INCORRECT
31,What is cancel culture and how does it relate to Donald Trump?,"Cancel culture is the practice of publicly shaming and boycotting individuals or groups who have expressed controversial opinions or beliefs. Some people believe that cancel culture has gone too far and that Donald Trump is a shield against it, protecting those who have been targeted by cancel culture.","Cancel culture refers to the practice of publicly calling out and boycotting individuals or entities that are deemed to have done something offensive or harmful, often resulting in damage to their reputation and career. In the context of Donald Trump, he is seen by some as a protector against cancel culture, as he has been able to survive numerous attempts to ""cancel"" him, such as impeachment and constant criticism from the media. His perceived ""uncancellability"" makes him a hero to those who oppose cancel culture.","PARTIALLY CORRECT. The student's answer accurately defines cancel culture, but their interpretation of how it relates to Donald Trump is subjective and not entirely accurate. The true answer provides a more objective explanation."
32,What are SPACs and how are they related to the proliferation of capital in the startup industry?,"SPACs are a type of cross-over investing that takes growth stage, private equity style risk in the public markets with the proliferation of capital. They are related to the proliferation of capital in the startup industry because they provide access to capital on the back end, allowing for more risk-taking on the early end and more bets to be made.","SPACs, or Special Purpose Acquisition Companies, are essentially shell companies that raise money through an initial public offering (IPO) with the purpose of acquiring a private company, taking it public in the process. They are related to the proliferation of capital in the startup industry because they provide an alternative way for startups to access public markets and raise significant capital. This increased access to capital allows startups to take more risks in their early stages and make more bets on their growth. The rise of SPACs has also led to a more vibrant entrepreneurial ecosystem, with more competition in financing and a faster path to going public for startups.","PARTIALLY CORRECT. The student accurately describes SPACs as shell companies that raise money through an IPO with the purpose of acquiring a private company and taking it public. They also correctly state that SPACs provide an alternative way for startups to access public markets and raise significant capital, which allows for more risk-taking and growth. However, the true answer emphasizes that SPACs are a type of cross-over investing that takes growth stage, private equity style risk in the public markets, which the student does not mention. Additionally, the true answer states that SPACs provide access to capital on the back end, allowing for more risk-taking on the early end and more bets to be made, which the student does not mention. Overall, the student's answer is mostly correct but lacks some important details from the true answer. Therefore, the grade is PARTIALLY CORRECT."
34,What are some potential outcomes for Bitcoin according to the speaker?,"The speaker mentions three potential outcomes for Bitcoin: being banned, facing significant financial loss, or continuing to grow despite government opposition.","Some potential outcomes for Bitcoin according to the speaker include: 
1. Bitcoin becoming a replacement for the US dollar or an alternative to traditional monetary systems.
2. Bitcoin persisting and having good staying power as an observer.
3. Bitcoin's value continuing to fluctuate, with people betting on whether it will go up or down in value.",INCORRECT
35,What is the grievance industrial complex and how does it relate to the media?,The grievance industrial complex is a group of people who manufacture grievances to manipulate the media. They invent stories to fit a certain narrative and know that it's easy to manipulate the media. This relates to the media because they fall for these stories and create sensationalized news without fact checking.,"The grievance industrial complex refers to a system where media outlets and content companies exploit controversies, conflicts, and grievances to generate clicks, views, and revenue. It relates to the media because these outlets often prioritize sensationalism and emotional appeal over objective reporting and truth-seeking. This can lead to the spread of misinformation, perpetuation of biases, and a lack of trust in the media. The grievance industrial complex thrives on creating and amplifying divisions, often at the expense of accurate and balanced reporting.",INCORRECT. The student's answer provides a more accurate and nuanced understanding of the grievance industrial complex and its relationship to the media. The true answer oversimplifies and misrepresents the concept.
42,What is the beauty of Silicon Valley according to the text?,"The beauty of Silicon Valley is that companies offer equity to everybody, which can create leverage in one's life and allow anyone to pursue a path of equity.","The beauty of Silicon Valley, according to the text, is its ability to reinvent other industries through technology, attract talent from various fields, and create an osmotic and permeable ecosystem that allows new people and ideas to enter. It has also benefited from the influx of capital from various sources, leading to more angel investing and venture capital opportunities. The ecosystem has evolved over time, becoming more diverse and inclusive, with various funding options available for startups and entrepreneurs.",INCORRECT
44,What is the reason for the energy crisis in Europe?,"The energy crisis in Europe is caused by the shutting off of 40 percent of the energy supply to the continent leading into winter, which is causing significant price climbs and is unbearable for the average household, small business, and small building. The lack of Russian energy is also contributing to the crisis.","The energy crisis in Europe is due to a combination of factors, including a heavy reliance on Russian natural gas (which accounts for 40% of Europe's energy consumption), reduced nuclear power capacity in France due to shutdowns over corrosion problems, droughts affecting hydroelectric power, and a shift away from nuclear energy and other sources due to environmental concerns. The ongoing conflict between Russia and Ukraine has also exacerbated the situation, as it has disrupted energy supplies and increased prices.",INCORRECT
48,What is the speaker's opinion on the concept of the metaverse?,"The speaker thinks that the concept of the metaverse is a renaming of something that has already been going on for a long time, and that people have been finding value in digital goods and accomplishments in the digital universe through games like Minecraft and Fortnite. The speaker believes that the notion of calling it the metaverse and trying to own it as a future singular universe is a misguided concept.","The speaker seems to be critical of the concept of the metaverse, particularly when it comes to Facebook's involvement. They believe that developers should not support Zuckerberg's vision of the metaverse and should instead focus on a decentralized, open-source platform. They also express concerns about giving Zuckerberg more power and the potential risks if Google and Apple take hardware costs to zero.",INCORRECT
49,What is inflation and how does it occur?,"Inflation is too much money chasing too few goods. It occurs when there is a shortage in the production of goods and services that people want, while there is a monetary and fiscal expansion coming out of Washington.","Inflation is the rate at which the general level of prices for goods and services is rising, and subsequently, the purchasing power of currency is falling. It occurs when there is too much money chasing too few goods. Inflation can happen in two ways: 1) when there is a massive increase in the supply of money, causing prices to go up as goods and services get repriced to absorb the increased money supply, and 2) when middle and lower-income people buy and spend more, as their increased consumption leads to higher demand for goods and services, pushing prices up. Factors such as labor shortages, fiscal and monetary expansion, and supply chain disruptions can also contribute to inflation.","INCORRECT. While the student's answer includes some accurate information, it is not entirely correct. The true answer states that inflation occurs when there is a shortage in the production of goods and services that people want, while the student's answer states that it occurs when there is too much money chasing too few goods. Additionally, the true answer mentions a monetary and fiscal expansion coming out of Washington, while the student's answer includes other factors such as labor shortages and supply chain disruptions."
